{
  "schemaVersion": 2,
  "id": "com.example.ui-only",
  "name": "UiOnly",
  "description": "UI-only fixture",
  "version": "1.0.0",
  "author": "Example",
  "icon": "puzzle-outline",
  "category": "text",
  "ui": { "entry": "ui/index.html" },
  "permissions": [],
  "official": false,
  "aiTools": []
}
